{
  "$schema": "schemas/canonicalisation-manifest.schema.json",
  "schemaVersion": 1,
  "artifactType": "CanonicalisationManifest",
  "evaluationDesignContractRevision": "retrieval-v2-evaluation-design-v1",
  "status": "frozen-unmaterialised-unscored",
  "authorityId": "AUTH-RB1-EVALUATION-DESIGN-FREEZE-001",
  "createdDate": "2026-08-12",
  "canonicalisationId": "retrieval-result-canonicalisation-v1",
  "domainAsciiEscaped": "RAG-CHALLENGE\\0retrieval-result-canonicalisation-v1\\0",
  "fieldFrame": "uint32_le(UTF-8 field-name length) + UTF-8 field name + uint8(typeTag) + uint64_le(payload length) + payload",
  "typeTags": { "text": "0x01", "enum": "0x02", "uint32": "0x03", "uint64": "0x04", "bytes": "0x05", "float32Sequence": "0x06", "float64": "0x07" },
  "textPolicy": "case-sensitive UTF-8 with no locale conversion or implicit normalisation",
  "vectorPolicy": "original order; IEEE 754 float32 bits; little-endian",
  "scorePolicy": "IEEE 754 float64 bits; little-endian",
  "signedZeroPolicy": "+0 and -0 tie for ranking and remain distinct in the digest",
  "digestAlgorithm": "SHA-256 over the complete framed stream",
  "passageTextPolicy": "absolutely excluded",
  "recordSchemas": ["ordered-raw-result", "ordered-selected-evidence"],
  "bindings": ["caseId", "retrievalPolicyVersion", "eligibilityPolicyId", "queryVectorSha256", "corpusId", "activationRevision", "indexGenerationId", "indexCompatibilityKey", "filters", "typedOutcome", "typedReason", "rawHitCount", "selectedEvidenceCount", "databaseProductId", "documentId", "documentVersion", "contentLanguage", "sourceAdapterId", "sourceTrustClass", "officialSourceRegistrationIdOrLocalSentinel", "officialSnapshotId", "globalChunkOrdinal", "chunkDigest", "exactSourceLocationDigest", "scoreBits", "maximumSelectedEvidence", "maximumSelectedEvidenceScalars"],
  "filterPolicy": "filters are ordinally sorted sets digested with the same framing",
  "rankedFieldNamePolicy": "field names repeat by rank with an eight-digit decimal index",
  "reproducibilityPlan": "two consecutive same-process executions plus one cold-start execution, RB-4 only",
  "materialisedDigestCount": 0
}
